{
  "id": "thm.nt.fermat-little-theorem",
  "entity_type": "theorem",
  "schema_version": "1.0.0",
  "status": "published",
  "theorem_kind": "theorem",
  "primary_topic_id": "nt.congruences-modular-arithmetic",
  "title": "Fermat Little Theorem",
  "slug": "fermat-little-theorem",
  "statement": {
    "source_format": "dual",
    "plain_text": "If p is prime and a is not divisible by p, then a^(p-1) ≡ 1 mod p.",
    "markdown": "If $p$ is prime and $p \\nmid a$, then $a^{p-1} \\equiv 1 \\pmod p$.",
    "latex": "p\\text{ prime},\\ p\\nmid a \\implies a^{p-1}\\equiv 1 \\pmod p"
  },
  "proof_status": "outline",
  "tracking_profile": {
    "is_trackable": true,
    "mastery_weight": 0.9,
    "review_priority": "high",
    "completion_criteria": ["understand", "restate", "apply", "prove"],
    "estimated_effort_minutes": 24
  },
  "proof_outline_steps": [
    {
      "source_format": "markdown",
      "plain_text": "Multiply each nonzero residue class modulo p by a.",
      "markdown": "Multiply each nonzero residue class modulo $p$ by $a$."
    },
    {
      "source_format": "markdown",
      "plain_text": "Because a is invertible modulo p, this multiplication permutes the nonzero residues.",
      "markdown": "Because $a$ is invertible modulo $p$, this multiplication permutes the nonzero residues."
    },
    {
      "source_format": "markdown",
      "plain_text": "Compare the product of the permuted list to the original list and cancel the common factors.",
      "markdown": "Compare the product of the permuted list to the original list and cancel the common factors."
    }
  ],
  "used_definition_ids": ["def.nt.congruence-modulo-n"],
  "example_ids": ["ex.nt.modular-inverse-check"],
  "problem_ids": ["prob.nt.remainder-7-power-100-mod-13"],
  "relation_refs": [
    {
      "relation": "used-in",
      "target": {
        "entity_type": "problem",
        "id": "prob.nt.remainder-7-power-100-mod-13"
      }
    }
  ],
  "audit": {
    "created_at": "2026-03-09T08:12:00Z",
    "updated_at": "2026-03-09T08:12:00Z",
    "created_by": "seed.bot",
    "updated_by": "seed.bot"
  }
}
