{
  "id": "thm.nt.bezout-identity",
  "entity_type": "theorem",
  "schema_version": "1.0.0",
  "status": "published",
  "theorem_kind": "theorem",
  "primary_topic_id": "nt.divisibility-gcd-prime-factorization",
  "title": "Bézout's Identity",
  "slug": "bezout-identity",
  "statement": {
    "source_format": "dual",
    "plain_text": "For integers a and b, there exist integers x and y such that ax + by = gcd(a,b).",
    "markdown": "For integers $a,b$, there exist integers $x,y$ such that $ax+by=\\gcd(a,b)$.",
    "latex": "\\text{For integers } a,b, \\text{ there exist integers } x,y \\text{ such that } ax+by=\\gcd(a,b)."
  },
  "proof_status": "outline",
  "proof_outline_steps": [
    {
      "source_format": "markdown",
      "plain_text": "Apply the Euclidean algorithm and back-substitute.",
      "markdown": "Apply the Euclidean algorithm and back-substitute."
    }
  ],
  "tracking_profile": {
    "is_trackable": true,
    "mastery_weight": 0.8,
    "review_priority": "normal",
    "completion_criteria": [
      "read",
      "understand",
      "apply"
    ],
    "estimated_effort_minutes": 20
  },
  "audit": {
    "created_at": "2026-03-08T10:00:00Z",
    "updated_at": "2026-03-08T10:05:00Z",
    "created_by": "system.seed",
    "updated_by": "system.seed"
  }
}
